{
  "schema_version": 5,
  "support_status": "fallback",
  "polling_interval_seconds": 10,
  "encryption": "none",
  "gatt": {
    "service_uuid": "00010203-0405-0607-0809-0a0b0c0d1910",
    "notify_char_uuid": "00010203-0405-0607-0809-0a0b0c0d2b10",
    "write_char_uuid": "00010203-0405-0607-0809-0a0b0c0d2b11"
  },
  "commands": {
    "power_off": "33 01 00 00 00 00 00 00 00 00 00 00 00 00 00 00 00 00 00 32",
    "power_on": "33 01 01 00 00 00 00 00 00 00 00 00 00 00 00 00 00 00 00 33",
    "state_query": "aa 01 00 00 00 00 00 00 00 00 00 00 00 00 00 00 00 00 00 ab",
    "status_query": "aa 19 00 00 00 00 00 00 00 00 00 00 00 00 00 00 00 00 00 b3",
    "fan_modes": {
      "Low": "3a 05 01 01 00 00 00 00 00 00 00 00 00 00 00 00 00 00 00 3f",
      "Medium": "3a 05 01 02 00 00 00 00 00 00 00 00 00 00 00 00 00 00 00 3c",
      "High": "3a 05 01 03 00 00 00 00 00 00 00 00 00 00 00 00 00 00 00 3d",
      "Sleep": "3a 05 05 00 00 00 00 00 00 00 00 00 00 00 00 00 00 00 00 3a",
      "Auto": "3a 05 03 00 00 14 00 00 00 00 00 00 00 00 00 00 00 00 00 28",
      "Turbo": "3a 05 07 00 00 00 00 00 00 00 00 00 00 00 00 00 00 00 00 38"
    }
  },
  "custom_auto": {
    "thresholds": [3, 5, 9, 15]
  }
}
